{
    "slug": "test-two-http-blocks",
    "title": "Test two HTTP Blocks",
    "description": "First Block makes a request to a URL and the second block makes a request result of First Block",
    "blocks": [
        {
            "id": "http_request",
            "slug": "test-block-first-slug",
            "description": "Request Local Resourse",
            "input": {
                "url": "http://localhost:3000"
            }
        },
        {
            "id": "http_request",
            "slug": "test-block-second-slug",
            "description": "Request Result from First Block",
            "input_config": {
                "property": {
                    "url": {
                        "origin": "test-block-first-slug"
                    }
                }
            }
        }
    ]
}